### ISSUE TITLE
question netmap-libpcap timestamp 

### ISSUE THREAD

**Issue by GoogleCodeExporter** [luigirizzo/netmap#22]
```
First, I apologize for double posting for I've posted this question on 
netmap-libpcap. But I decided posted here as there are more contributors on 
this project email list.  

What steps will reproduce the problem?
1.Run tcpdump with netmap mode enabled (with high traffic 10G over 
ixgbe(withnetmap patch))
2.Run tcpdump without netmap (with high traffic 10 over ixgbe)
3.Compare timestamp, under high traffic, netmap mode captured packets exhibits 
signs of "batch timestamp"

What is the expected output? What do you see instead?
Expected timestamp is to be be per packet, it seems netmap is time stamping the 
entire ring buffer with the same value

What version of the product are you using? On what operating system?
OS: Ubuntu 14.04 64bit (3.13.0-36-generic)
netmap git HEAD: 3ccdadad7d80bb1bc569d1f72ba3ece902350f65
netmap-libpcap git HEAD: 0890b993dae48767af172b693f2d664181dbe943
tcpdump: version 4.5.1

Please provide any additional information below.

Below are captured at 10G rate (at 1500 bytes), below is tcpdump without netmap 
(shows micro-level differences between each packet)

14:26:37.475718 IP 192.85.1.4 > 193.85.1.4:  ip-proto-253 1462
14:26:37.475726 IP 192.85.1.4 > 193.85.1.4:  ip-proto-253 1462
14:26:37.475727 IP 192.85.1.4 > 193.85.1.4:  ip-proto-253 1462
14:26:37.475728 IP 192.85.1.4 > 193.85.1.4:  ip-proto-253 1462
14:26:37.475729 IP 192.85.1.4 > 193.85.1.4:  ip-proto-253 1462

However, on the netmap mode capture, groups of packets had the same timestamp

14:15:19.931624 IP 192.85.1.4 > 193.85.1.4:  ip-proto-253 1462
14:15:19.931624 IP 192.85.1.4 > 193.85.1.4:  ip-proto-253 1462
14:15:19.931624 IP 192.85.1.4 > 193.85.1.4:  ip-proto-253 1462
14:15:19.931624 IP 192.85.1.4 > 193.85.1.4:  ip-proto-253 1462
14:15:19.931624 IP 192.85.1.4 > 193.85.1.4:  ip-proto-253 1462


Examining the code, I found this under /bpf/net/netmap_user.h

#define D(_fmt, ...)                                            \
        do {                                                    \
                struct timeval t0;                              \
                gettimeofday(&t0, NULL);                        \
                fprintf(stderr, "%03d.%06d %s [%d] " _fmt "\n", \
                    (int)(t0.tv_sec % 1000), (int)t0.tv_usec,   \
                    __FUNCTION__, __LINE__, ##__VA_ARGS__);     \
        } while (0)

/* Rate limited version of "D", lps indicates how many per second */
#define RD(lps, format, ...)                                    \
    do {                                                        \
        static int t0, __cnt;                                   \
        struct timeval __xxts;                                  \
        gettimeofday(&__xxts, NULL);                            \
        if (t0 != __xxts.tv_sec) {                              \
            t0 = __xxts.tv_sec;                                 \
            __cnt = 0;                                          \
        }                                                       \
        if (__cnt++ < lps) {                                    \
            D(format, ##__VA_ARGS__);                           \
        }                                                       \
    } while (0)
#endif

It seems to be an intended design, but I wanted to check with the netmap team 
on this. The downside of batch timestamping is we are observing out of order 
packets. 

Thank you for looking into this and again I'm sorry for double posting
```

Original issue reported on code.google.com by `morph...@gmail.com` on 30 Sep 2014 at 7:19
