### ISSUE TITLE
Question: Unable to disable GRO on virtio - any options?

### ISSUE THREAD

**Issue by sybevnao** [luigirizzo/netmap#610]
Previously, we have used a custom kernel module that utilizes netfilter to drop certain traffic. As we're exploring ways to more efficiently handle large amounts of packets, we are looking into netmap actively. Whilst we're getting wonderful results with ixgbe based NICs, we face an issue with servers that are virtualized, hence require using the virtio driver.

On a ixgbe NIC, we can disable offloads with the following command:

`ethtool -K ens0f2 tx off rx off gso off tso off gro off lro off rxhash off rxvlan off`

which does not work in our virtualized testing environment:

```
Cannot change rx-checksumming
Cannot change large-receive-offload
Cannot change rx-vlan-offload
Cannot change receive-hashing
Could not change any device features
```

The hypervisors are running KVM and openvswitch. We would still love to try out netmap on our virtualized servers too, however, we are facing problems with TCP packets. The server is uplinked with 10Gbps, yet, with netmap in front (in a bridge configuration that just spits out packets to the emulated NIC), we observe TCP throughput of 30KB/s - obviously due to generic receive offloading. The hypervisor / openvswitch seems to offload, hence we receive offloaded packets on the "NIC" of our virtual machine already.

We may totally be missing something here, but after I was looking through the docs, I found no remark if there is any solution to use netmap in such an environment? We have no way to change from virtio to e1000, nor can we switch away from openvswitch (as obviously that would turn out as non-sense, the hypervisor would then bottleneck eliminating any use for netmap within the virtual machine).

**Comment by vmaffione** [comment]
Hi,
  Which Linux version/distro is running in the guest?
You cannot change many NIC features because they are already off. The netmap-patched virtio-net driver is compiled in such a way that NIC offloads features are not negotiated with the hypervisor. IOW, that command is not needed for `tx,rx,tso,lro,rxhash,rxvlan`. You can check that this is the case using the command `ethtool -k ens0f2`, and checking that the relevant entries are set to "off".
Generic receive offloading (GRO) is not a device feature, but a Linux network stack feature, and that can be changed. Indeed you can see that the command:
````
   # ethtool -K ens0f2 gro off
````
will work.

I don't understand how your setup is like.
Why are you saying that switching away from openvswitch would result in a bottlneck? Maybe you are using OVS-DPDK? Because if you are using OVS with the kernel datapath, that's a bottleneck, and your sentence wouldn't make sense..

Why do you think GRO (in the guest network stack) is causing throughput degradation? 30 KB/s clearly means you have something misconfigured, unsupported, and causing systematic packed drops. I don't see how GRO could cause this.

You describe a "bridge" configuration.. is that inside the guest or outside? IOW are you using netmap both in the guest and on the host?

**Comment by sybevnao** [comment]
Both guest and hypervisor are running Debian 9. I'm not sure, possibly I confused GRO and GSO here. Either way, the hypervisor has a openvswitch bridge, with the virtual machine and it's physical interface being part of it, the bottleneck would be when we change from a openvswitch bridge to a normal linux bridge. I understand it's a bottleneck already still, but not as much.

I assumed it was GRO/GSO related, because when I do a tcpdump during a wget download without netmap enabled, I do see the following:

```
16:37:39.818810 IP 185.94.194.3.54184 > 108.61.210.117.80: Flags [R], seq 1072685680, win 0, length 0
16:37:39.819094 IP 108.61.210.117.80 > 185.94.194.3.54184: Flags [.], seq 57171385:57175729, ack 166, win 235, options [nop,nop,TS val 2596426273 ecr 34542533], length 4344: HTTP
16:37:39.819099 IP 185.94.194.3.54184 > 108.61.210.117.80: Flags [R], seq 1072685680, win 0, length 0
16:37:39.819316 IP 108.61.210.117.80 > 185.94.194.3.54184: Flags [.], seq 57175729:57201793, ack 166, win 235, options [nop,nop,TS val 2596426273 ecr 34542533], length 26064: HTTP
16:37:39.819321 IP 185.94.194.3.54184 > 108.61.210.117.80: Flags [R], seq 1072685680, win 0, length 0
16:37:39.819444 IP 108.61.210.117.80 > 185.94.194.3.54184: Flags [.], seq 57201793:57219169, ack 166, win 235, options [nop,nop,TS val 2596426273 ecr 34542533], length 17376: HTTP
```

To my understanding that's offloading related - yet I have no way to change this (or just don't see it).

**Comment by vmaffione** [comment]
Both GSO and GRO are not device-specific features, but implemented in the Linux network stack. GSO is for transmit, GRO is for receive. You can disable or enable those at will, using the command indicated above. If you run `wget` in the guest, then it is true that GRO can explain the large packets you see in tcpdump. Nevertheless, GRO will not impact negatively your TCP.

You are describing a very common bridge configuration, using the regular Openvswitch backed by a kernel module (you can verify that by checking that the `openvswitch` kernel module is loaded, using the command `lsmod | grep openvswitch`). It looks like you are convinced that openvswitch is faster than normal linux bridge. Why? In terms of packet rate this is not true, or rather openvswitch can only be slower, as it is more complex.

Moreover, openvswitch and linux bridge are not the only solutions. There is also the VALE switch and netmap passthrough. It depends on what you want to do, and how your workload will look like. Netmap can help you if you need high packet rates (1 Mpps or more).

**Comment by sybevnao** [comment]
I know what `GRO` and `GSO` mean, I am however uncertain how they influence traffic as it gets passed from the hypervisor to the virtual machine. From past "testings", we have determined that GRO/GSO can indeed negatively impact TCP throughput, relevant primarily that too large packets *will* get discarded in certain situations, only letting small packets through, hence the window size isn't going to increase and the throughput stays in the KB/s area. I just assumed it can be related to that based upon that.

I'm not fond of Openvswitch myself, the point merely is that in this particular case where I am observing the 30KB/s throughput with netmap enabled, I am unable to control the hypervisor. I can only tell what it's based on, how it runs, but I can't make any changes to it. I'm stuck with what I'm given and can only change the guest. I'm aware it's not going to be awesome in terms of performance.

I know of VALE, but as I can't mangle the hypervisor's configuration or setup, I'm stuck with what I'm given. My idea of using netmap was to implement packet discarding within netmap, so I have user space level control as packets enter the device. I've previously used netfilter within the kernel on that particular guest to discard packets, but netmap gives more control, has WAY higher performance in non-virtualized environments and allows me to track packets better.

My question merely is, do you see a way to get netmap to work in this guest? Sadly the 30KB/s throughput is kind of a deal killer, but I can't mangle the hypervisor so I'm very limited. To my understanding, I'd need to get it to work to either fragment those large offloaded packets or allow them to be buffered and processed?

**Comment by vmaffione** [comment]
If you think GRO/GSO is causing packet drops, let's disable it.
````
  # ethtool -K eth0 gro off gso off
````
If you are using host rings (see below), you need to do this anyway.

Netmap should work in your guest. If it doesn't, it's either a bug related to virtio-net or misconfiguration.
Can you specify how exactly you use netmap? Are you forwarding packets between the virtio-net hw rings and the virtio-net host rings?

What do you mean by "netmap enabled"? What throughput do you get when netmap is not loaded in the guest?

**Comment by sybevnao** [comment]
I've reinstalled the server and I'm keeping this as simple as possible now.

Download without anything enabled:
```
:~# wget -4 http://fra-de-ping.vultr.com/vultr.com.100MB.bin -O /dev/null
--2019-04-23 18:04:27--  http://fra-de-ping.vultr.com/vultr.com.100MB.bin
Resolving fra-de-ping.vultr.com (fra-de-ping.vultr.com)... 108.61.210.117
Connecting to fra-de-ping.vultr.com (fra-de-ping.vultr.com)|108.61.210.117|:80... connected.
HTTP request sent, awaiting response... 200 OK
Length: 104857600 (100M) [application/octet-stream]
Saving to: ‘/dev/null’

/dev/null                    100%[==============================================>] 100.00M   111MB/s    in 0.9s

2019-04-23 18:04:28 (111 MB/s) - ‘/dev/null’ saved [104857600/104857600]
```

Disabling gro/gso
```
:~# ethtool -K eth0 gro off gso off
```

Enabling netmap bridge

```
:~# bridge built Apr 21 2019 02:08:15

184.795922 main [246] same interface, endpoint 0 goes to host
184.796208 nm_mmap [989] do not mmap, inherit from parent
184.796286 main [268] ------- zerocopy supported
184.796328 main [275] Wait 4 secs for link to come up...
188.796503 main [279] Ready to go, eth0 0x1/1 <-> eth0 0x0/1.
```

Let's download again:

```
--2019-04-23 18:06:45--  http://fra-de-ping.vultr.com/vultr.com.100MB.bin
Resolving fra-de-ping.vultr.com (fra-de-ping.vultr.com)... 108.61.210.117
Connecting to fra-de-ping.vultr.com (fra-de-ping.vultr.com)|108.61.210.117|:80... connected.
HTTP request sent, awaiting response... 200 OK
Length: 104857600 (100M) [application/octet-stream]
Saving to: ‘/dev/null’

/dev/null                      0%[                                               ] 320.59K   107KB/s    eta 15m 58s
```

This behavior is beyond my brief understand of how netmap works. All I can say is that I saw similar behavior when the window wasn't able to scale up, which was in adverse caused by large packets (which end up offloaded on eth0) being dropped.

Do you see anything here I could try to get netmap to work... with better speeds?

**Comment by vmaffione** [comment]
Ok, what does `dmesg` say?

**Comment by sybevnao** [comment]
Pretty much nothing.

```
[231133.848458] 124.598056 [ 295] generic_netmap_unregister Emulated adapter for eth0 deactivated
[231133.848485] 124.598084 [1035] generic_netmap_dtor       Emulated netmap adapter for eth0 destroyed
[646036.722895] 029.461134 [1129] generic_netmap_attach     Emulated adapter for eth0 created (prev was           (null))
[646036.722929] 029.461171 [ 320] generic_netmap_register   Emulated adapter for eth0 activated
[646036.722973] 029.461215 [ 835] tc_configure              ifp eth0 qdisc netmapemu parent 4294967295 handle 0
```

No error messages or anything.

**Comment by vmaffione** [comment]
You are not using the netmap patched driver for `eth0`. As you can see from the log, you are using the emulated adapter. Have you forgot to load the `virtio_net.ko` module built by netmap?
