### ISSUE TITLE
Bridge app does not work in zero copy mode

### ISSUE THREAD

**Issue by srini38** [luigirizzo/netmap#856]
Hi,
    I am testing netmap code (synced to commit 2de030223d6610a95a9c8ba6f96031e46968b00f) in Ubuntu 18.04.6 LTS virtual machine using 4.19.49 mainline kernel. The virtual machine is running on ESXI 6.0.0 server and is using vmxnet3 interfaces.

I tested the bridge app and I could only get it working with the -c option. Without the -c option the packets seem to get garbled. Is this a known issue?

steps used.

`sudo ./bridge -c -i netmap:ens192 -i netmap:ens224
./bridge built May 24 2022 18:52:12

802.677213 main [294] ------- zerocopy NOT supported
802.677264 main [301] Wait 4 secs for link to come up...
806.677389 main [305] Ready to go, ens192 0x0/8 <-> ens224 0x0/8.
809.180248 main [367] poll timeout [0] ev 1 0 rx 0@0 tx 4087, [1] ev 1 0 rx 0@0 tx 4087
812.283544 main [367] poll timeout [0] ev 1 0 rx 0@0 tx 4087, [1] ev 1 0 rx 0@0 tx 4087
814.786245 main [367] poll timeout [0] ev 1 0 rx 0@0 tx 4087, [1] ev 1 0 rx 0@0 tx 4087

Without the -c option

sudo ./bridge  -i netmap:ens192 -i netmap:ens224

ping 120.0.0.10 
PING 120.0.0.10 (120.0.0.10) 56(84) bytes of data.

tcpdump: verbose output suppressed, use -v or -vv for full protocol decode
listening on ens161, link-type EN10MB (Ethernet), capture size 262144 bytes
09:50:58.975661 IP 120.0.0.20 > 120.0.0.10: ICMP echo request, id 1043, seq 17, length 64
09:50:58.975760 IP 120.0.0.10 > 120.0.0.20: ICMP echo reply, id 1043, seq 17, length 64
**09:51:03.994265 IP truncated-ip - 38 bytes missing! 120.0.0.20 > 120.0.0.10: ICMP echo request, id 1043, seq 18, length 64**
09:51:04.359058 ARP, Request who-has 120.0.0.20 tell 120.0.0.10, length 28
09:51:04.996378 IP truncated-ip - 38 bytes missing! 120.0.0.20 > 120.0.0.10: ICMP echo request, id 1043, seq 19, length 64
09:51:05.383040 ARP, Request who-has 120.0.0.20 tell 120.0.0.10, length 28
09:51:05.998437 IP truncated-ip - 38 bytes missing! 120.0.0.20 > 120.0.0.10: ICMP echo request, id 1043, seq 20, length 64
09:51:06.407047 ARP, Request who-has 120.0.0.20 tell 120.0.0.10, length 28

`

**Comment by Emjayen** [comment]
I can report I'm also observing this behavior when simply forwarding between the NIC and host stack; originally I believed it to be a bug in my software, however the bridge tool also exhibits the same.

Hypervisor: VirtualBox on Windows 10.
Guest: ClearLinux 5.10.113-64.lts2020

This issue does not present when using netmap on bare-metal (either Linux or Windows). Tested on several different physical machines and a variety of NICs.

**Comment by jhk098** [comment]
So is this issue happing when using emulated mode (no native driver support, e.g. vmxnet/virtio on linux)?

**Comment by Emjayen** [comment]
> So is this issue happing when using emulated mode (no native driver support, e.g. vmxnet/virtio on linux)?

Native.

**Comment by Emjayen** [comment]
Small update: This issue appears to be unique to virtio -- with pure virtualization (e1000 tested) this issue does not occur. I'm leaning towards this maybe being an issue with VBox's virtio backend implementation.
